<?xml version="1.0" encoding="UTF-8"?>
<deployment xmlns:xsi="http://www.w3.org/2001/XMLSchema-instance" xsi:noNamespaceSchemaLocation="deploy-config-schema.xsd">
	<executions>
		<group name="数据库全部安装与卸载">
			<execution name="全部安装" id="installDbAll" display="true" class-name="deploy.OperRunDependency">
				<dependencies>
					<dependency ref-id="installMysqlAndInitDb"/>
				</dependencies>
			</execution>
			<execution name="全部卸载" id="uninstallDbAll" display="true" class-name="deploy.OperRunDependency">
				<dependencies>
					<dependency ref-id="uninstallMysql">
						<result skip="true" />
					</dependency>
				</dependencies>
			</execution>
		</group>
		<group name="MySQL安装与卸载">
			<execution name="安装MySQL及初始化数据库" id="installMysqlAndInitDb" display="true" class-name="deploy.OperRunDependency">
				<dependencies>
					<dependency ref-id="installMysql"/>
					<dependency ref-id="createMysqlDb"/>
				</dependencies>
				<sub-execution>
					<execution name="安装MySQL" id="installMysql" display="true" class-name="deploy.OperRunCommand">
						<configuration>
							<commands>
								<command>
									<exec><![CDATA[scripts/windows/db/mariadb/install_mysql.bat]]></exec>
									<args>
										<arg><![CDATA[$${server.mysql.port}]]></arg>
									</args>
								</command>
							</commands>
						</configuration>
						<dependencies>
							<dependency ref-id="updateConfigFiles"/>
							<dependency ref-id="syncOsTime"/>
						</dependencies>
					</execution>
					<execution name="初始化MySQL数据库" id="createMysqlDb" display="true" class-name="deploy.OperRunCommand">
						<configuration>
							<commands>
								<command>
									<exec><![CDATA[scripts/windows/db/mariadb/import_mysql_link.bat]]></exec>
									<args>
										<arg><![CDATA[$${server.mysql.port}]]></arg>
										<arg><![CDATA[$${server.mysql.dbname}]]></arg>
										<arg><![CDATA[$${server.mysql.db.username}]]></arg>
										<arg><![CDATA[$${server.mysql.db.password}]]></arg>
									</args>
								</command>
							</commands>
						</configuration>
						<dependencies>
							<dependency ref-id="updateConfigFiles"/>
							<dependency ref-id="syncOsTime"/>
						</dependencies>
					</execution>
				</sub-execution>
			</execution>
			<execution name="卸载MySQL" id="uninstallMysql" display="true" class-name="deploy.OperRunCommand">
				<configuration>
					<commands>
						<command>
							<exec><![CDATA[scripts/windows/db/mariadb/uninstall_mysql.bat]]></exec>
						</command>
					</commands>
				</configuration>
			</execution>
		</group>
		<group name="基本功能">
			<execution name="更新配置及脚本文件" id="updateConfigFiles" display="true" class-name="deploy.OperUpdateFile">
				<configuration>
					<replace-files>
						<replace-file file-type="template">
							<!-- mysql配置文件 -->
							<target>
								<source><![CDATA[template/windows/db/software/mariadb/my.cnf]]></source>
								<destination><![CDATA[$${deployment_home}/software/mariadb/my.cnf]]></destination>
							</target>
							<!--更新脚本-->
							<target>
								<source><![CDATA[template/windows/db/package/sql/dorcst.sql]]></source>
								<destination><![CDATA[$${deployment_home}/package/sql/dorcst.sql]]></destination>
							</target>
						</replace-file>
					</replace-files>
				</configuration>
			</execution>
			<execution name="调整系统时间同步间隔" id="syncOsTime" display="true" class-name="deploy.OperRunCommand">
				<configuration>
					<commands>
						<command>
							<exec><![CDATA[scripts/windows/common/sync_os_time.bat]]></exec>
						</command>
					</commands>
				</configuration>
			</execution>
			<execution name="查看配置参数" id="listConfigData" display="true" class-name="deploy.OperListConfig"/>
		</group>
	</executions>
</deployment>